[
  {
    "test_id": "ADV-1159cf61",
    "test_name": "test_concurrent_duplicate_requests_create_one_transaction",
    "category": "concurrency",
    "result": "PASS",
    "observed": "test passed",
    "expected": "test should pass",
    "counterexample": null,
    "duration_ms": 0.01
  },
  {
    "test_id": "ADV-51b26b0b",
    "test_name": "test_concurrent_different_payments_both_succeed",
    "category": "concurrency",
    "result": "PASS",
    "observed": "test passed",
    "expected": "test should pass",
    "counterexample": null,
    "duration_ms": 0.02
  },
  {
    "test_id": "ADV-30308af0",
    "test_name": "test_high_concurrency_duplicate_creates_one_transaction",
    "category": "concurrency",
    "result": "PASS",
    "observed": "test passed",
    "expected": "test should pass",
    "counterexample": null,
    "duration_ms": 0.02
  },
  {
    "test_id": "ADV-4667bd75",
    "test_name": "test_zero_amount_payment_rejected",
    "category": "edge_cases",
    "result": "PASS",
    "observed": "test passed",
    "expected": "test should pass",
    "counterexample": null,
    "duration_ms": 0.02
  },
  {
    "test_id": "ADV-6b1286ec",
    "test_name": "test_negative_amount_payment_rejected",
    "category": "edge_cases",
    "result": "PASS",
    "observed": "test passed",
    "expected": "test should pass",
    "counterexample": null,
    "duration_ms": 0.02
  },
  {
    "test_id": "ADV-67be0b23",
    "test_name": "test_missing_payment_id_rejected",
    "category": "edge_cases",
    "result": "PASS",
    "observed": "test passed",
    "expected": "test should pass",
    "counterexample": null,
    "duration_ms": 0.03
  },
  {
    "test_id": "ADV-d7daa2ee",
    "test_name": "test_missing_amount_rejected",
    "category": "edge_cases",
    "result": "PASS",
    "observed": "test passed",
    "expected": "test should pass",
    "counterexample": null,
    "duration_ms": 0.03
  },
  {
    "test_id": "ADV-7381c9a6",
    "test_name": "test_same_payment_id_five_retries_one_transaction",
    "category": "edge_cases",
    "result": "PASS",
    "observed": "test passed",
    "expected": "test should pass",
    "counterexample": null,
    "duration_ms": 0.02
  },
  {
    "test_id": "ADV-df0cca37",
    "test_name": "test_very_large_amount_accepted",
    "category": "edge_cases",
    "result": "PASS",
    "observed": "test passed",
    "expected": "test should pass",
    "counterexample": null,
    "duration_ms": 0.02
  },
  {
    "test_id": "ADV-34fda549",
    "test_name": "test_same_payment_id_twice_creates_one_transaction",
    "category": "idempotency",
    "result": "PASS",
    "observed": "test passed",
    "expected": "test should pass",
    "counterexample": null,
    "duration_ms": 0.04
  },
  {
    "test_id": "ADV-af0f1c7f",
    "test_name": "test_idempotency_both_responses_return_same_transaction_id",
    "category": "idempotency",
    "result": "PASS",
    "observed": "test passed",
    "expected": "test should pass",
    "counterexample": null,
    "duration_ms": 0.04
  },
  {
    "test_id": "ADV-a877a968",
    "test_name": "test_different_payment_ids_are_independent",
    "category": "idempotency",
    "result": "PASS",
    "observed": "test passed",
    "expected": "test should pass",
    "counterexample": null,
    "duration_ms": 0.02
  },
  {
    "test_id": "ADV-e4d472a6",
    "test_name": "test_idempotency_survives_service_retry_loop",
    "category": "idempotency",
    "result": "PASS",
    "observed": "test passed",
    "expected": "test should pass",
    "counterexample": null,
    "duration_ms": 0.01
  },
  {
    "test_id": "ADV-17936c22",
    "test_name": "test_original_bug_scenario_fixed",
    "category": "idempotency",
    "result": "PASS",
    "observed": "test passed",
    "expected": "test should pass",
    "counterexample": null,
    "duration_ms": 0.02
  },
  {
    "test_id": "ADV-495bac7a",
    "test_name": "test_normal_payment_creates_one_transaction",
    "category": "regression",
    "result": "PASS",
    "observed": "test passed",
    "expected": "test should pass",
    "counterexample": null,
    "duration_ms": 0.01
  },
  {
    "test_id": "ADV-cccd0836",
    "test_name": "test_different_payments_are_independent",
    "category": "regression",
    "result": "PASS",
    "observed": "test passed",
    "expected": "test should pass",
    "counterexample": null,
    "duration_ms": 0.01
  },
  {
    "test_id": "ADV-b67f79ef",
    "test_name": "test_payment_response_contains_transaction_id",
    "category": "regression",
    "result": "PASS",
    "observed": "test passed",
    "expected": "test should pass",
    "counterexample": null,
    "duration_ms": 0.02
  }
]